{
  "schema_version": "1.0",
  "id": "0001",
  "pack_id": "sample",
  "size": 5,
  "difficulty": "easy",
  "seed": 12345,
  "clue_count": 8,
  "max_gap": 8,
  "givens": [
    {"row": 0, "col": 0, "value": 1},
    {"row": 0, "col": 4, "value": 5},
    {"row": 1, "col": 2, "value": 9},
    {"row": 2, "col": 0, "value": 13},
    {"row": 2, "col": 4, "value": 17},
    {"row": 3, "col": 2, "value": 21},
    {"row": 4, "col": 0, "value": 25},
    {"row": 4, "col": 4, "value": 21}
  ],
  "solution": [
    {"row": 0, "col": 0, "value": 1},
    {"row": 0, "col": 1, "value": 2},
    {"row": 0, "col": 2, "value": 3},
    {"row": 0, "col": 3, "value": 4},
    {"row": 0, "col": 4, "value": 5},
    {"row": 1, "col": 0, "value": 12},
    {"row": 1, "col": 1, "value": 11},
    {"row": 1, "col": 2, "value": 10},
    {"row": 1, "col": 3, "value": 9},
    {"row": 1, "col": 4, "value": 8},
    {"row": 2, "col": 0, "value": 13},
    {"row": 2, "col": 1, "value": 14},
    {"row": 2, "col": 2, "value": 15},
    {"row": 2, "col": 3, "value": 16},
    {"row": 2, "col": 4, "value": 17},
    {"row": 3, "col": 0, "value": 24},
    {"row": 3, "col": 1, "value": 23},
    {"row": 3, "col": 2, "value": 22},
    {"row": 3, "col": 3, "value": 21},
    {"row": 3, "col": 4, "value": 20},
    {"row": 4, "col": 0, "value": 25},
    {"row": 4, "col": 1, "value": 6},
    {"row": 4, "col": 2, "value": 7},
    {"row": 4, "col": 3, "value": 19},
    {"row": 4, "col": 4, "value": 18}
  ]
}
