{
  "schema_version": "1.0",
  "id": "0005",
  "pack_id": "daily-nov",
  "size": 5,
  "difficulty": "easy",
  "seed": 500746445,
  "clue_count": 13,
  "max_gap": null,
  "givens": [
    {
      "row": 0,
      "col": 2,
      "value": 21
    },
    {
      "row": 0,
      "col": 3,
      "value": 22
    },
    {
      "row": 0,
      "col": 4,
      "value": 23
    },
    {
      "row": 1,
      "col": 2,
      "value": 20
    },
    {
      "row": 1,
      "col": 3,
      "value": 25
    },
    {
      "row": 1,
      "col": 4,
      "value": 24
    },
    {
      "row": 2,
      "col": 1,
      "value": 1
    },
    {
      "row": 2,
      "col": 2,
      "value": 2
    },
    {
      "row": 2,
      "col": 3,
      "value": 3
    },
    {
      "row": 2,
      "col": 4,
      "value": 4
    },
    {
      "row": 3,
      "col": 3,
      "value": 7
    },
    {
      "row": 3,
      "col": 4,
      "value": 5
    },
    {
      "row": 4,
      "col": 4,
      "value": 6
    }
  ],
  "solution": null
}